{
  "id": "INSURANCE-AGENCY-IT-DEFAULT",
  "name": "Agenzia Assicurativa Italia",
  "description": "Configurazione per gestione documenti agenzia assicurativa — polizze, sinistri, perizie, certificati medici, RCA e multi-ramo",
  "schemaVersion": 1,
  "documentTypes": [
    {
      "id": "doc-attestato-rischio",
      "name": "Attestato di Rischio",
      "description": "Attestato di rischio RCA — classe di merito, sinistri pregressi",
      "jsonSchema": {
        "type": "object",
        "properties": {
          "compagnia": {
            "type": "string",
            "description": "Compagnia assicurativa emittente"
          },
          "contraente": {
            "type": "string",
            "description": "Nome e cognome del contraente"
          },
          "codiceFiscaleContraente": {
            "type": "string",
            "description": "Codice Fiscale di 16 caratteri (extract without spaces - remove all spacing if present)",
            "pattern": "^[A-Z]{6}[0-9]{2}[A-Z][0-9]{2}[A-Z][0-9]{3}[A-Z]$"
          },
          "targa": {
            "type": "string",
            "description": "Numero di targa del veicolo (es. AB123CD)"
          },
          "classeMeritoProvenienza": {
            "type": "string",
            "description": "Classe di merito CU provenienza"
          },
          "classeMeritoAssegnazione": {
            "type": "string",
            "description": "Classe di merito CU assegnazione"
          },
          "sinistri": {
            "type": "array",
            "description": "Tabella sinistri ultimi 5 anni",
            "items": {
              "type": "object",
              "properties": {
                "anno": {
                  "type": "number",
                  "description": "Anno del sinistro"
                },
                "responsabilita": {
                  "type": "string",
                  "description": "Tipo responsabilità",
                  "enum": [
                    "principale",
                    "paritaria",
                    "nessuna",
                    null
                  ],
                  "nullable": true
                },
                "tipo": {
                  "type": "string",
                  "description": "Tipo sinistro (cose, persone)"
                },
                "importo": {
                  "type": "number",
                  "description": "Importo liquidato in Euro"
                }
              },
              "required": [
                "anno",
                "responsabilita"
              ]
            }
          },
          "anniAssicurazione": {
            "type": "number",
            "description": "Anni di osservazione assicurativa"
          },
          "dataEmissione": {
            "type": "string",
            "description": "Data emissione attestato",
            "pattern": "^\\d{2}\\.\\d{2}\\.\\d{4}$"
          }
        },
        "required": [
          "compagnia",
          "contraente",
          "targa",
          "classeMeritoProvenienza",
          "classeMeritoAssegnazione"
        ]
      }
    },
    {
      "id": "doc-certificato-morte",
      "name": "Certificato di Morte",
      "description": "Certificato di morte — per liquidazione polizza vita caso morte",
      "jsonSchema": {
        "type": "object",
        "properties": {
          "defunto": {
            "type": "object",
            "properties": {
              "nome": {
                "type": "string",
                "description": "Nome (first name). In Italia, l'ordine standard è: nome prima, cognome dopo (es. Mario Rossi)."
              },
              "cognome": {
                "type": "string",
                "description": "Cognome (surname/family name). In Italia, l'ordine standard è: nome prima, cognome dopo (es. Mario Rossi)."
              },
              "codiceFiscale": {
                "type": "string",
                "description": "Codice Fiscale di 16 caratteri (extract without spaces - remove all spacing if present)",
                "pattern": "^[A-Z]{6}[0-9]{2}[A-Z][0-9]{2}[A-Z][0-9]{3}[A-Z]$"
              },
              "dataNascita": {
                "type": "string",
                "description": "Data di nascita",
                "pattern": "^\\d{2}\\.\\d{2}\\.\\d{4}$"
              },
              "luogoNascita": {
                "type": "string",
                "description": "Luogo di nascita"
              }
            },
            "required": [
              "nome",
              "cognome",
              "codiceFiscale"
            ]
          },
          "dataDecesso": {
            "type": "string",
            "description": "Data del decesso",
            "pattern": "^\\d{2}\\.\\d{2}\\.\\d{4}$"
          },
          "luogoDecesso": {
            "type": "string",
            "description": "Luogo del decesso"
          },
          "causaDecesso": {
            "type": "string",
            "description": "Causa del decesso (se indicata)"
          },
          "comune": {
            "type": "string",
            "description": "Comune che ha rilasciato il certificato"
          },
          "dataRilascio": {
            "type": "string",
            "description": "Data di rilascio",
            "pattern": "^\\d{2}\\.\\d{2}\\.\\d{4}$"
          }
        },
        "required": [
          "defunto",
          "dataDecesso",
          "luogoDecesso"
        ]
      }
    },
    {
      "id": "doc-certificato-medico",
      "name": "Certificato Medico",
      "description": "Certificato medico per lesioni da sinistro o infortunio coperto da polizza",
      "jsonSchema": {
        "type": "object",
        "properties": {
          "paziente": {
            "type": "object",
            "properties": {
              "nome": {
                "type": "string",
                "description": "Nome (first name). In Italia, l'ordine standard è: nome prima, cognome dopo (es. Mario Rossi)."
              },
              "cognome": {
                "type": "string",
                "description": "Cognome (surname/family name). In Italia, l'ordine standard è: nome prima, cognome dopo (es. Mario Rossi)."
              },
              "codiceFiscale": {
                "type": "string",
                "description": "Codice Fiscale di 16 caratteri (extract without spaces - remove all spacing if present)",
                "pattern": "^[A-Z]{6}[0-9]{2}[A-Z][0-9]{2}[A-Z][0-9]{3}[A-Z]$"
              },
              "dataNascita": {
                "type": "string",
                "description": "Data di nascita",
                "pattern": "^\\d{2}\\.\\d{2}\\.\\d{4}$"
              }
            },
            "required": [
              "nome",
              "cognome",
              "codiceFiscale"
            ]
          },
          "medico": {
            "type": "string",
            "description": "Nome e cognome del medico"
          },
          "struttura": {
            "type": "string",
            "description": "Struttura sanitaria / ospedale"
          },
          "dataVisita": {
            "type": "string",
            "description": "Data della visita/referto",
            "pattern": "^\\d{2}\\.\\d{2}\\.\\d{4}$"
          },
          "diagnosi": {
            "type": "string",
            "description": "Diagnosi — copia VERBATIM dal certificato"
          },
          "prognosi": {
            "type": "string",
            "description": "Prognosi — giorni di guarigione o invalidità"
          },
          "giorniPrognosi": {
            "type": "number",
            "description": "Numero giorni di prognosi"
          },
          "invaliditaPermanente": {
            "type": "number",
            "description": "Percentuale di invalidità permanente (se indicata)"
          },
          "terapiaPrescritta": {
            "type": "string",
            "description": "Terapia prescritta"
          }
        },
        "required": [
          "paziente",
          "medico",
          "dataVisita",
          "diagnosi"
        ]
      }
    },
    {
      "id": "doc-stato-famiglia",
      "name": "Certificato Stato Famiglia",
      "description": "Certificato stato di famiglia — per polizze vita e beneficiari",
      "jsonSchema": {
        "type": "object",
        "properties": {
          "intestatario": {
            "type": "object",
            "properties": {
              "nome": {
                "type": "string",
                "description": "Nome (first name). In Italia, l'ordine standard è: nome prima, cognome dopo (es. Mario Rossi)."
              },
              "cognome": {
                "type": "string",
                "description": "Cognome (surname/family name). In Italia, l'ordine standard è: nome prima, cognome dopo (es. Mario Rossi)."
              },
              "codiceFiscale": {
                "type": "string",
                "description": "Codice Fiscale di 16 caratteri (extract without spaces - remove all spacing if present)",
                "pattern": "^[A-Z]{6}[0-9]{2}[A-Z][0-9]{2}[A-Z][0-9]{3}[A-Z]$"
              },
              "indirizzo": {
                "type": "string",
                "description": "Indirizzo di residenza"
              }
            },
            "required": [
              "nome",
              "cognome",
              "codiceFiscale"
            ]
          },
          "componenti": {
            "type": "array",
            "description": "Componenti del nucleo familiare",
            "items": {
              "type": "object",
              "properties": {
                "nome": {
                  "type": "string",
                  "description": "Nome (first name). In Italia, l'ordine standard è: nome prima, cognome dopo (es. Mario Rossi)."
                },
                "cognome": {
                  "type": "string",